jobTitle,postedDate,jobDescription,jobUrl
Graduate Software Developer / Programmer,16-Jan-23,"<p>If you are fresh graduate, this role is for you to get the fundamental right, you will be put under guidance of senior engineer for 3 to 6 months, day to day operation on testing of software, familiarize with environment, tool, and you will be assign to <strong>ONE</strong> of the following path after the said period:-</p><p><strong>Application Development</strong></p><p>You will learn and exposed to: HTML, CSS, Javascript, jQuery Angular, React, Android, iOS, RESTful API, Unity3D, C#</p><ul><li>Involved in creation of web apps, mobile apps, desktop apps and many more.</li><li>Involved in creation of metrics, data enrichment, widgets and many more.</li><li>Crafting dashboards, reports, configuration pages to ease users both internal and external to navigate throughout the system.</li></ul><p><strong>System Analyst / Big Data / Data Analyst</strong></p><p>You will learn and exposed to: Data analytic, Data Science, Superset, Tableau, Requirement Gathering</p><ul><li>Involved in data analytic, fiddling around with data and making sense of it.</li><li>Involved in identifying key metrics that allow creating business decision making for customers.</li></ul><p><strong>AI and IoT</strong> </p><p>You will learn and exposed to: Embedded firmware (Texas Instrument, ST Micro), CNN, RNN, CUDA, MLFlow, OpenPAI, C/C++, Python</p><ul><li>Involved in embedded firmware development, integrating with sensors, and putting in algorithms.</li><li>Involved in AI model training, data labeling, classification, fine tuning ML Ops.</li></ul><p><strong>DevOps Engineer</strong></p><p>You will learn and exposed to: GitLab, Jenkin, Docker, Kubernetes, Grafana, Prometheus, Site Reliability</p><ul><li>Involved in running, optimizing DevOps, and bringing the team into automation.</li><li>Involved in setting, maintaining and deploying required tools that enable DevOps.</li></ul><p><strong>Sales Engineer</strong></p><p>You will learn and exposed to: Presentation, Solution Consulting, Requirement Gathering, Communication, Planning</p><ul><li>Involved in preparing and developing technical presentations to propose our company's products or services as a solution to customers' problems.</li><li>Involved in creating and delivering powerful presentations, demos that are able to clearly communicate the uniqueness of the value proposition in a simple manner.</li><li>Involved in effectively communicating client needs with internal R&amp;D teams for future product and service enhancements.</li></ul><p>Preferred graduate from Computer Science, Software Engineering, Information System, Electronic and Electrical, Mechatronic, Information Technology and related courses.</p><p>Possible career opportunities after completed 2 years of training: Back End Developer, Front End Developer, Web Developer, Mobile App Developer, .NET Developer, Full Stack Developer, Image Processing Specialist, Data Scientist, Support Engineer, System Analyst, IoT, Database Administrator, Data Engineer, Software Developer, DevOps Engineer, Embedded Software Engineer</p><p>Data Analyst ,Big Data,Computer Science ,IT ,AI ,System Analyst ,Business Analyst ,Information Technology ,Programming ,Programmer ,C# ,Data Science ,Fresh Graduate ,Database Administrator ,DBA ,Software Engineer, Software Developer ,IoT ,Cloud Computing ,Web Development ,Frontend ,HTML ,Java ,Python ,Full Stack ,Image Processing ,Artificial Intelligence ,Intelligent System ,Networking ,Application ,Firmware ,Embedded, Power BI</p>",https://www.jobstreet.com.my/en/job/graduate-software-developer-programmer-5247063
Customer Success Manager Intern (May Intake),26-Jan-23,"<p>A Customer Success Manager drives business value and technology outcomes throughout the customer lifecycle with C&amp;CS (Cloud &amp; Cognitive Software) Growth Offerings to support Hybrid Cloud Platform strategy. As a Customer Success Manager intern, you will apply your technical skills to help our customers achieve their business outcomes with hybrid cloud &amp; AI Growth Offerings. You will be responsible for use case identification, MVP builds, and drive adoption of IBM Growth Offerings.</p><p>IBM’s comprehensive Sales Intern Program and industry-leading learning culture will prepare you with a strong foundation for client success and skills to take with you at the conclusion of the internship. Our sales environment is collaborative and experiential. You’ll be surrounded by bright minds and keen co-creators ready to assist as you apply practices that will compel our clients to invest in IBM’s products and services.</p><p><strong>Your Role and Responsibilities</strong></p><p>IBM Malaysia’s internship program is a program geared toward current university students to place them in industry and prepare them for corporate and community leadership. IBM Internship program offers students the following benefits:</p><ul><li>Get a basic understanding of IBM organization and, business processes &amp; high-performance culture</li><li>An opportunity to engage in real assignments/projects</li><li>Excellent chances to develop personal skills such as teamwork, communication</li><li>A chance to fully integrate with IBMers and collate information about career direction</li><li>The potential to build contacts to help with future placement.</li></ul><p><strong>Job Description:</strong></p><p>A ‘Day-in-the Life’ of a Customer Success Manager intern may include, but not be limited to:</p><ul><li>Responsible for use case identification and value realization for Cloud &amp; Cognitive Software (C&amp;CS) Growth Offerings</li><li>Architects and co-creates MVP alongside customer practitioners</li><li>Drives increased usage and adoption for C &amp;CS Growth Offerings</li><li>Demonstrates the value of C&amp;CS Growth Offerings to the customer and identifies additional opportunities for adoption.</li></ul><p>To be successful in this role, you will need:</p><ul><li>Understand customer business and technology needs.</li><li>Co-defines customer roadmap for implementation and value realization alongside the customer.</li><li>Serves as a trusted technical expert for customers’ cloud migration and deployment of C&amp;CS Growth Offerings</li><li>Conduct workshops with customers to align IT architecture, integration &amp; migration requirements.</li><li>Execute customer success plan to drive adoption post-deployment.</li><li>Build and execute retention and expansion plays.</li><li>Willingness to take initiative and tackle things on your own.</li></ul><p><strong>Required Technical and Professional Expertise</strong></p><ul><li>B.S. in Computer Science, Data Science, Engineering, M.I.S., or equivalent experience in Computer Science/Information Systems/Engineering.</li><li>Professional verbal, written, and interpersonal skills.</li><li>Demonstrated team collaboration and navigating different communication styles.</li><li>Readiness to independently travel to local IBM clients and meeting – up to 10%</li><li>You may work with any of the following technologies: Analytics, Artificial Intelligence, Cloud &amp; Cognitive software or Security.</li><li>Preferrable experience and skills on enterprise software implementations/operation in 1 or 2 of this areas:</li><li style=""margin-left:30px"">Enterprise Workflow</li><li style=""margin-left:30px"">Integration technology e.g. Kafka, MQ, Rest API</li><li style=""margin-left:30px"">Data Management</li><li style=""margin-left:30px"">Data Science e.g. AI, Predictive</li><li style=""margin-left:30px"">Security e.g. Threat Management, Access management</li><li style=""margin-left:30px"">Observability e.g. application/performance management</li></ul>",https://www.jobstreet.com.my/en/job/customer-success-manager-intern-may-intake-5256529
Machine Learning Engineer,9-Jan-23,"<p>Are you as fascinated by Skynet as we are? You won't be building that here (yet) but you will be working alongside our diversely talented team and building impactful solutions. Your motto is ""Yes, we can automate that!"" You will be part of the integral team that will aid the technical development and deployment of algorithmic, automated, and innovations that Carro is undertaking. Come and have a chat with us!</p><p><strong>What you will be doing:</strong></p><ul><li>Contribute to the development of machine-learning innovations, including but not limited to machine learning, computer vision, acoustic signal processing, and artificial intelligence</li><li>Work closely with the Chief Data Scientist to further enhance Carro as a deep-tech South East Asia</li><li>Build robust data collection procedures and highly scalable APIs</li><li>Processing, cleansing, and verifying the integrity of data used for analysis</li><li>Design, build and handle the deployment of ML models and acute awareness of optimized server configurations</li><li>Build innovative approaches to automated repurposing and redeployment of the ML models</li><li>Design and build recommendation engines to improve the user experience of our products</li></ul><p><strong>What you will need:</strong></p><ul><li>Bachelor, Master or Ph.D. in Computer Science, Statistics, Computational Finance, Mathematics, Economics or quantitative discipline</li><li>At least 3 years of hands-on industry experience in building and deploying end to end machine learning platforms</li><li>Strong working knowledge of engineering and coding skills (Python, Javascript..etc)</li><li>Good understanding of current algorithms such as gradient boosting machines, e.g XGBoost</li><li>Good understanding of decision trees, linear regression, and NLP with preference to candidates with hands-on experience.</li><li>Good understanding of various cloud-based solutions, other high/low-level languages (PHP, Ruby..etc) is advantageous</li><li>Hands-on experience with TensorFlow, PyTorch, and Scikit.</li><li>Demonstrable track record of hands-on experience in distributed data platforms and processing frameworks</li><li>Good communication skills to communicate with technical and non-technical stakeholders</li><li>Demonstrated ability to operate as a high-performing member of a small cross-functional team</li></ul>",https://www.jobstreet.com.my/en/job/machine-learning-engineer-5239870
Senior Lecturers,9-Jan-23,"<ul><li>Lectureship in various disciplines and focus areas;</li><li>To carry out teaching, research and administration work within the Faculty;</li><li>Undertake and publish impactful academic research; </li><li>Involve actively in public engagement and interdisciplinary collaboration.</li></ul><p><strong>Job Requirements</strong></p><p>Possess recognised PhD / Doctorate degrees and/or relevant professional qualifications in one of the following areas:</p><p><strong>Faculty of Applied Sciences </strong></p><ul><li>Exercise Physiology / Human Movement Analysis / Performance Analysis</li></ul><p><strong>Faculty of Computing and Information Technology</strong></p><ul><li>Games &amp; Graphics Programming / Data Science / Augmented / Virtual Reality / Analytics / Computer Networking / Information Security Management &amp; Forensic / Internet of Things / Database / Enterprise Resource Planning / Operating Systems / Mobile Application Development / Artificial Intelligence / Cloud Computing / Computer Science / Software Engineering / Mathematics / Statistics</li></ul><p><strong></strong> <strong>Faculty of Accountancy, Finance and Business</strong></p><ul><li>Auditing / Taxation / Management / Logistics / Entrepreneurship / Marketing / Human Resource / Financial Accounting &amp; Reporting / Management Accounting / Law / Banking / Retail Management / Finance / Economics Statistics / Corporate Governance</li></ul><p><strong>Faculty of Engineering and Technology</strong></p><ul><li>Thermodynamics / Heat Transfer &amp; Fluid Mechanics / Embedded Systems Engineering / Automation &amp; Robotics / Electronic Materials / Physical Metallurgy / Fracture Mechanic / Failure Analysis</li></ul><p><strong>Faculty of Built Environment</strong></p><ul><li>Measurement / Building / Contract Administration / Construction Economics / Construction Management / Malaysian Legal System / Construction &amp; Property Laws / Land Acquisition Law / Property Taxation Law / Uniform Building By-Laws / Procurement Strategy / QS Practices / Estimating / Valuation / Town &amp; Country Planning / Land Economics / Urban Land Administration / Real Property Finance &amp; Investment Analysis / Civil Engineering Construction Technology / Site Surveying / Project Planning &amp; Management / GIS in Property Management / International Construction / Value &amp; Risk Management / CADD / Microsoft &amp; Primavera Software Applications / Interior Design Studio / Graphic Communication for Interiors / Interior Architecture Technology / Lighting and Acoustics / Design Theory for Interiors / Environmental Psychology / History of Interior Architecture / Interior Design Management &amp; Practice</li></ul><p><strong>Faculty of Communication and Creative Industries</strong></p><ul><li>Audio Video Editing / Film Making / Photography / Web Streaming / Public Relations Events Management / Multimedia Tool for Public Relations and Advertisements / Advertising Theories / Media Aesthetic &amp; Rhetoric / Creative Writing / Online Marketing / Design in Society / Design Management / Interactive Web Design / Information &amp; Interface Design / New Media / Web/Mobile Programming / 2D/3D Animation / Digital Illustration / Digital Video Production / Fashion Production / Fashion Software Expertise / Sculpture</li></ul><p><strong>Faculty of Social Science and Humanities</strong></p><ul><li>Tourism Management / Cognitive Psychology / Advanced Research Methodology / Advanced Statistics / Early Childhood Education</li></ul><p><strong>Centre for Pre-University Studies</strong></p><ul><li>Accounting / Business / Computer Science / Social Science / English Language</li></ul><p><strong>Based at Penang Branch</strong></p><ul><li>Human Resource / Finance / Computer Science / Electronic Engineering / Mass Communication</li></ul><p><strong>Based at Perak Branch</strong></p><ul><li>Accounting / Software Engineering</li></ul><p><strong>Based at Johor Branch</strong></p><ul><li>Management / Finance / Computer Science</li></ul><p><strong>Based at Pahang Branch</strong></p><ul><li>Accounting / Finance / Business Administration / E-Commerce / Logistics / Computer Science / English Language</li></ul><p><strong>Based at Sabah Branch</strong></p><ul><li>Accounting / Banking &amp; Finance / Management / Computer Science / English Language/ Hospitality Management</li></ul>",https://www.jobstreet.com.my/en/job/senior-lecturers-5239561
Design Verification Engineer (Malaysia),6-Jan-23,"<p><strong><u>Job Description:</u></strong></p><p>1. The SOC Verification Engineer will be responsible for pre-silicon RTL verification of block and top level SOC. With deep understanding of SOC architecture and meticulous attention to details, you will interact with all disciplines to develop reusable testbench and verification environment deploying the latest methodology with metric driven verification.</p><p>2. Develop comprehensive test plans, design direct and random test cases to verify the correctness of the hardware design.</p><p>- Work with hardware team for RTL implementation and perform verification and validation of hardware functions.</p><p>- Work with firmware team for firmware development, debug and integration.</p><p>- Work with S/W team for SoC level integration and debug, using FPGA or emulators.</p><p>- Work with SoC architect for system modeling, performance prediction, evaluation and verification.</p><p><strong><u>Job Requirements:</u></strong></p><p>- BSCS, MSCS, BSEE or MSEE degree</p><p>- Strong communication, analytical and documentation skills and ability to interface with other groups.</p><p>- VLSI functional verification experience, preferably with exposure to complex, high speed custom VLSI products</p><p>- Strong C/C++ programming experience.</p><p>- Verilog/SystemVerilog/UVM experience.</p><p>- Familiar with shell scripts, perl or python.</p><p>- Familiar with computer architecture or artificial intelligence</p><p>- Experience or knowledge of SoC, ARM cores, AMBA bus, USB 2.0/3.0, PCIe gen2/3, and CPU peripherals.</p><p>- Experience or knowledge of verification IP</p>",https://www.jobstreet.com.my/en/job/design-verification-engineer-malaysia-5238027
Data Engineer,16-Jan-23,"<p><strong>Job Summary:</strong></p><p>Data Engineers execute their role within and as overall support to the Data Services Systems &amp; Support Team. Individually, a Data Engineer’s contribution primarily focuses on writing pre-processing scripts in Python to ingest customer data into the Alegion AI Enablement Platform as well as post-processing scripts that validate or transform finalized data to be delivered to our customers. Additionally, overall team contributions can be made by utilizing SQL to create or update Sisense dashboards that extract critical business operations data from the Alegion AI Enablement Platform, as well as creating workflows and task templates required to execute data labeling within the platform.</p><p><strong>Responsibilities and Expected Results:</strong></p><ul><li>Execute script writing assignments in a timely manner in order to meet customer requirements</li><li>Deliver accurate Sisense dashboards according to stakeholder needs that are fully tested and documented.</li><li>Deliver accurate workflow and task template solutions according to stakeholder needs that are fully tested and documented.</li><li>Support stakeholders in a timely manner regarding technical issues within the platform</li></ul><p><strong>Key Tasks:</strong></p><ul><li>Writing and executing pre-processing and post-processing scripts in Python</li><li>Creating and updating Sisense dashboards in SQL</li><li>Creating workflows and task templates within the Alegion platform utilizing JSON</li><li>Assist the team in troubleshooting technical issues within the platform</li><li>Help guide and mentor the technical analysts on the DS Systems &amp; Support Team</li><li>Effectively utilize Alegion software and apps to receive and deliver work assignments</li><li>Create and maintain comprehensive documentation related to your scope of work</li><li>Establish and maintain cooperative and effective working relationships with others</li><li><br /></li></ul><p><strong>Required Knowledge and Skills:</strong></p><ul><li>Python</li><li>SQL - PostgreSQL and Amazon Redshift</li><li>JSON - Or ability to learn it</li><li>Ability to learn and understand the Alegion database structure</li><li>Proficient in verbal and written communication in English</li></ul><p><strong>Required Education and Experience:</strong></p><ul><li>Bachelors in Software Engineering, Computer Science, Systems Engineering, Data Analytics or similar.</li><li>Python scripting and ETL Automation experience</li><li>BI tools such as Tableau, Power BI, Sisense, or Google Data Studio is an advantage</li><li>At least 5 years work experience within the information technologies/software development industries.</li><li>Experience and/or exposure to the Artificial Intelligence/Machine Learning domain is an advantage</li></ul><p><strong>Location:</strong> Kuala Lumpur, Malaysia</p><p><strong>Hours:</strong> 40 hours per week</p>",https://www.jobstreet.com.my/en/job/data-engineer-5247543
Senior Artificial Intelligence Engineer,10 hours ago,"<b>Description</b><p>Development of AI software products for processing of images, analysis and development of the models, development and acquisition of images for training and testing, development of UI and customization of existing AI systems in the market.</p><div><p>This role will be responsible for the development of KeyAsic advanced technologies particularly to do with Deep learning (CNN) modeling, model development, model deployment, large scale database analysis and algorithms. The Data Scientist/AI/ML Engineer is responsible for participating in the full array of predictive modeling activities at KeyAsic, either independently or under the leadership of a supervisor. Conduct quantitative analyses, co-author study reports, and create innovative analytic approaches.</p><p>The position will also serve as a content expert in data modeling techniques applied to large claims databases. Accountable for the execution of advanced analytic models, and will be responsible for technical review of research, synthesis, and dissemination of results to enable innovative products &amp; Data review, feedback, and quality control.</p></div><div>Qualifications<br /><ul><li>Ph. D. or be close to completing in Computer Science, Mathematics, Physics, EE or a related discipline</li><li>Or 2 years’ experience within a similar role developing deep learning models.</li></ul><br />• Experienced in AI-FDA , AI Process - medical Image<br />• Possess strong research experience and a solid publication record in Machine Learning<br />• Expert level programming experience (Python, Tensor Flow, PyTorch, OpenCV)<br />• Should have a strong interest in applying Machine Learning models to healthcare problems<br />• Be comfortable working independently and as part of an interdisciplinary team<br />• Experience in Healthcare is highly desirable though it is not necessary</div><b>Company</b><p><br />KeyASIC Berhad was incorporated in Malaysia in year 2005. In 2006, we were awarded with Multimedia Super Corridor (MSC) Status by Malaysia Digital Economy Corporation (MDEC). We started off with the design of IP, ASIC and SoC. We now have more than 10 SoC’s manufactured in Silterra 0.18um, 0.16um and 0.13um process technologies. In 2009, we were listed on the main board of KLSE. Khazanah and CIMB are our main investors.</p><p>Our core competency is the capability to design SoC and ASIC from system specification and architectural level to GDSII. The key differentiator is our expertise in designing high performance, low power consumption and smaller integrated circuits. We are building up to be a leader in IoT.</p><p>KeyASIC Berhad focuses on improving lives by providing IoT-enabling technology in the area of healthcare, wellness applications, consumer electronics, industrial equipment and many other applications. Leverage on KeyASIC’s integrated microcontrollers and wireless connectivity for continual technology improvement.</p><p>In addition to the current products, we have the ability of Artificial Intelligence (AI) chip technology and that can be applied to the healthcare, surveillance among other industries. KeyASIC will continue to invest in research and development of products based on IoT, Block Chain and Artificial Intelligence.</p>-",https://www.jobstreet.com.my/en/job/senior-artificial-intelligence-engineer-1034606156
Senior Production Engineer,10 hours ago,"<b>Description</b><p>Job Description:-<br />1) Reviewing production schedule, process, specification and related information.<br />2) Preparing materials and equipment list.<br />3) Involving in developing automated process designing and production standard.<br />4) Knowledge in Artificial Intelligence (A.I)</p><p>Job Specification:-<br />1) At least a Bachelor Degree in Engineering which specializes in Automation<br />2) At least 5 years and above related work experience especially in automation industry<br />3) Proficiency in Microsoft office and autocad<br />4) Advanced in production machinery process</p><b>Company</b><p>With close to 20 years in this industry, Infinity Logistics &amp; Transport is a logistics provider offering innovative and cost effective logistics solutions globally for different industries with strong presence in Southeast Asia and business coverage over 15 countries.</p><p>Established in early 2003 by Chan Kong Yew and Ethan Kwan, the company now provides 4 main services including;<br />(i) Flexitank Solution and Related Services,<br />(ii) Integrated Freight Forwarding Services,<br />(iii) Railroad Transportation services, and<br />(iv) Logistics Centre and related services.</p><p>The founder’s leadership in implementing the vision, as well as empowering staff and good management skills has advanced the company from a humble beginning to where it is today.</p><p>Infinity is ranked top fifth player in the Flexitank Solution and related services market in the world in terms of the flexitank produced. We are also the largest landbridge services provider between Malaysia and Thailand. In addition, we are the fourth largest player as a NVOCC in the busiest port in Malaysia, namely Port Klang. On top of it, we are also one of the largest 20′ high cube containers operator in Southeast Asia.</p><p>With an excellent track record and the future in mind, they are determine to continue to expand their range of services, investing prudently and tapping into a whole new spectrum of market.</p>-",https://www.jobstreet.com.my/en/job/senior-production-engineer-1034606419
