jobTitle,postedDate,jobDescription,jobUrl
Online Digital Marketer & Trainer,14 hours ago,"<b>Description</b><p>a) Promote College educational program for students enrollment.<br />b) Promote cafe F&amp;B, courier business to clients.<br />c) Ability to talk without fear , energetic , positive thinking and cheerful.<br />d) Knowledge in online social media tools such as FB, Instagram, Whatsapp, Wechat and Youtube. Good in online advertisement will be a plus point.</p><b>Company</b><p>Top Skills College solely owned by Top Learning Academy Sdn Bhd was newly setup in August 2014. It was located strategically at Alma, Bukit Mertajam in Penang.</p><p>Our vision is to become as a one-stop training solution by strategically, holistically, professionally &amp; conspicuously to our strategic partners and employers. Our mission statement emphasizes continuous improvement in quality, technology, service &amp; training.</p><p>Top Skills College training programs are well designed and executed by pool of high profile trainers and speakers. There are a number of highly potent trainers/speakers with vast experience in engineering, telecommunication, programming, management, manufacturing, IT and multimedia.</p><p>Top Skills believes in practical skill oriented training where our training center equipped with mechanical workshop and computer laboratory. We also collaborated with approved institutions such as UTMSPACE, Lincoln University, JPK and HRDF.</p><p>Currently, we are conducting engineering program such as robotic, mechatronic, electrical, mechanical, electronic, cad design, artificial intelligence, six sigma,<br />motor, PLC, pneumatics etc.<br />We are also teaching computer science program such as multimedia and programming in Python, Java, C# etc.<br /></p>-",https://www.jobstreet.com.my/en/job/online-digital-marketer-trainer-1034451356
Admin cum Account Executive,14 hours ago,"<b>Description</b><p>Update accounts receivable and accounts payable.<br />Update financial data into databases to ensure information is accurate<br />Perform research &amp; resolves all issues in processes.<br />Maintain proper filing of accounting &amp; all taxes documents for record keeping<br />in soft &amp; hard copy.<br />Monitor all account payable checks, prepare invoices for all and prepare update<br />on all account<br />Organize customer contracts &amp; evaluate all agreements &amp; invoices.<br />Responsible in office administration including document preparation, filling,<br />phone answering, parcel receiving &amp; delivery.<br />Prepare record of minutes of meetings.<br />Manage all petty cash &amp; Workers Wages &amp; Staff Claims<br />Monitor work of QS and coordinate with management &amp; recommend improvement in quality of accounting &amp; provide operational support.<br />Monitor efficient working of HR, employee benefit &amp; others.<br />Prepare PO to suppliers &amp; follow up on lead time.<br />Prepare Quotation to customer.</p><b>Company</b><p>Home+ (MK Perwaja Sdn Bhd), our mission goes beyond providing technology solutions.<br />Since established in 2016, Home+ focused on R&amp;D of smart home technology, including wireless connection, smart electrical engineering, home automation, smart access control, home security, environment-dependent temperature control, artificial intelligence etc. Is not only the leading pioneer of smart gadgets, but also all-in-one smart tech solution provider in green energy system, smart home, smart community and hotel systems.</p>-",https://www.jobstreet.com.my/en/job/admin-cum-account-executive-1034382943
Marketing Intern,14 hours ago,"<b>Description</b><p>Monitor and manage our social media channels (Facebook, Instagram)<br />Conduct thorough research on industry-related topics and generate strategies &amp; ideas for new digital content.<br />Create, produce and write engaging &amp; informational content (videos/blogs/infographics etc) across our social media and website that our audience can relate to.<br />Review analytics for actionable insights to help shape our social media strategy and future content.<br />Write engaging marketing copy.<br />Support team on other marketing activities, if required.</p><p>Requirements:<br />Candidates must possess at least a Diploma/ Bachelor’s Degree in Marketing, Mass Communication, Advertising/Media or equivalent.<br />Able to work independently and is self-motivated with a good work ethic.<br />Passion for the marketing industry and its best practices.<br />Required language(s): English, Mandarin and Bahasa Malaysia.<br />Familiar with social media platforms<br />Creative with new ideas and initiatives<br />Minimum internship period of 3 months.</p><b>Company</b><p>Nest Butler is a custom-made furniture design company founded by a mechanical engineer and an interior designer. We questioned a number of problems that have existed for decades, e.g. ambiguous pricing, expensive operating model, constant delays in project delivery, unmet customer's expectation on product design and quality and etc.. We strived to resolve these issues by taking advantage of the 21st-century technologies such as Artificial Intelligence, Cloud Computing and Internet of Things to revolutionise a century old industry that hasn't been disrupted for decades.</p>-",https://www.jobstreet.com.my/en/job/marketing-intern-1034451505
Technician - Electrical,14 hours ago,"<b>Description</b><p>Jobs Descriptions:</p><p>An Electrician's primary job is to ensure that a certain area's power systems function optimally and that their installations comply with the Code of Practice set by the Department of Standards Malaysia. To installs and repairs electrical wiring, systems, and fixtures in buildings.</p><p>Electrician Job Responsibilities:</p><p>• Installs conduits and pipes to house electrical wires and cables.<br />• Ensures piping complies with electrical codes.<br />• Installs circuit breakers and other electrical hardware and connects wiring to them.<br />• Inspecting fixtures, electrical wiring, and troubleshooting problems.<br />• Good communication and interpersonal skills<br />• Friendly with a great deal of patience<br />• Good physical condition and strength with the ability to work in awkward spaces</p><p>Education and Experience Requirements:</p><p>- Posses a Diploma or its equivalent in Electrical Engineering from institutions recognised by the Public Service Department (PSD) or accredited by the Malaysian Qualification Agency (MQA).<br /></p><b>Company</b><p>Nest Butler is a custom-made furniture design company founded by a mechanical engineer and an interior designer. We questioned a number of problems that have existed for decades, e.g. ambiguous pricing, expensive operating model, constant delays in project delivery, unmet customer's expectation on product design and quality and etc.. We strived to resolve these issues by taking advantage of the 21st-century technologies such as Artificial Intelligence, Cloud Computing and Internet of Things to revolutionise a century old industry that hasn't been disrupted for decades.</p>-",https://www.jobstreet.com.my/en/job/technician-electrical-1034450690
Human Resources Executive,15 hours ago,"<b>Description</b><p>1) Handle staff documentation<br />2) Planning for staff training and development<br />3) Support the management regarding staff disciplinary and grievance issues<br />4) Maintain employee record according to Company policy and legal recruitment<br />5) Coordinate staff benefit and welfare<br />6) Designing and updating existing company policy and regulation<br />7) Assist in staff performance and rewards<br />8) Handle ad-hoc task and all related job as per advised by supervisor<br />9) Self-motivated and possess the ability to work independently as well as able to work with others as a team.<br />10) Ability to be flexible, and handle multiple priorities in team-based environment.<br />11) An ability and desire to travel and work in different locations.<br /></p><b>Company</b><p>Malvus Sense Sdn. Bhd. was established on 25 Mei 2016 and the headquarters located at Bandar Seri Putra Bangi, Selangor while the branch office located at Miri, Sarawak. The company specializes in Unmanned Aircraft System (UAS) Services across various fields. Malvus Sense is a 100% bumiputera company.</p><p>The main business segment covers airborne informatic – Engineering, Geological, Geospatial Technology Analytic and Solutions, Geospatial Data Management, IT and Artificial Intelligence. Besides, the company also provides sales and service of industrial UAV-related products, counter UAS -detection and elimination. The company also conduct a professional UAS Pilot and GIS Spatial Data Consultation and Training.</p>-",https://www.jobstreet.com.my/en/job/human-resources-executive-1034589000
Sales Designer,14 hours ago,"<b>Description</b><p>Jobs Descriptions:</p><p>Responsible for personal sales performance, establishing contact and developing good relationships with prospects; recommending solutions prospects. To handle customers queries and complaints promptly and professionally.</p><p>Sales Designer Job Responsibilities:</p><p>• Meet and exceed targets set for sales, daily and monthly<br />• Record, analyse and report sales in system<br />• Maintains professional and technical knowledge by attending educational workshops or work related seminars<br />• To develop design concept and space planning with detailed work specifications<br />• Work closely with the design teams in preparation of 3D visualization<br />• Perform other duties as assigned from time to time.</p><p>Education and Experience Requirements:</p><p>- With/Without experience are welcome to apply (training provided)<br />- Good communication skill, customer service oriented and dedicated to provide excellent customer service<br />- Confident, out-going, approachable, energetic &amp; possess positive attitude<br />- Ability to multi-task in a demanding fast paced environment and work independently<br /></p><b>Company</b><p>Nest Butler is a custom-made furniture design company founded by a mechanical engineer and an interior designer. We questioned a number of problems that have existed for decades, e.g. ambiguous pricing, expensive operating model, constant delays in project delivery, unmet customer's expectation on product design and quality and etc.. We strived to resolve these issues by taking advantage of the 21st-century technologies such as Artificial Intelligence, Cloud Computing and Internet of Things to revolutionise a century old industry that hasn't been disrupted for decades.</p>-",https://www.jobstreet.com.my/en/job/sales-designer-1034451794
Electronic Engineers (Drone Maintenance Officer),13 hours ago,"<b>Description</b><p>Job Description<br />- Conduct routine maintenance on UAV drones<br />- Troubleshoot malfunctioning or defective drones, and repair issues discovered<br />- Inspect drones for maintenance issues or possible malfunctions before flights<br />- Assist with the development of simulation exercises designed to test drones for real-word scenarios<br />- Build and repair drones and related hardware.<br />- Communicate with clients to troubleshoot problem both remotely and on site.</p><p>Requirements:<br />- Familiarity with electronics troubleshooting process &amp; basic tools.<br />- Detailed oriented and structured work etiquette.<br />- Willing to travel regionally for various projects.<br />- Either technical certification in electronic/mechanical/aviation related field or engineering degree</p><p>Good to have<br />- Experience flying drones commercially.<br />- Previously experienced with XAG drone or assembled and setup DIY drones based on Ardupilot platform.<br />- Experience with electronics repair work.<br />- Experience with 3D printing and laser cutting/engraving works.</p><b>Company</b><p>Our products are commercially applied on a global scale. As the world's first and only agriculture technology company, we take pride in our ability to offer truly integrated hardware and software solutions for smart agriculture.<br />In order to grow more nutritious food with minimal ecological footprint on earth, we have designed a three-pillar smart agriculture solution innovatively integrating robots, internet-of-things, and artificial intelligence.</p>-",https://www.jobstreet.com.my/en/job/electronic-engineers-drone-maintenance-officer-1034450931
Finance Executive,14 hours ago,"<b>Description</b><p>1) Assisting with the preparation of financial report<br />2) Procurement<br />3) Company asset monitoring<br />4) Creating and implementing financial policies of the organization<br />5) Petty cash monitoring<br />6) Maintain receipts and records for all the business transactions<br />7) Assisting the managerial team in budgeting, taxes, and investments<br />8) Monitor the economic and financial changes<br />9) Performing regular financial analysis; resolving issues<br />10) Handle ad-hoc task and all related job as per advised by supervisor<br />11) Self-motivated and possess the ability to work independently as well as able to work with others as a team.<br />12) Ability to be flexible, and handle multiple priorities in team-based environment.<br />13) An ability and desire to travel and work in different locations.<br /></p><b>Company</b><p>Malvus Sense Sdn. Bhd. was established on 25 Mei 2016 and the headquarters located at Bandar Seri Putra Bangi, Selangor while the branch office located at Miri, Sarawak. The company specializes in Unmanned Aircraft System (UAS) Services across various fields. Malvus Sense is a 100% bumiputera company.</p><p>The main business segment covers airborne informatic – Engineering, Geological, Geospatial Technology Analytic and Solutions, Geospatial Data Management, IT and Artificial Intelligence. Besides, the company also provides sales and service of industrial UAV-related products, counter UAS -detection and elimination. The company also conduct a professional UAS Pilot and GIS Spatial Data Consultation and Training.</p>-",https://www.jobstreet.com.my/en/job/finance-executive-1034588991
Interior Designer,14 hours ago,"<b>Description</b><p>The ideal candidate will have excellent creative thinking skills and be able to create designs based on conversations with a client. The candidate should be confident communicating regularly with the client in order to assess their needs and be able to adjust a given approach based on feedback. The candidate should maintain familiarity with the interior design landscape and trends in order to provide the best ideas for clients.</p><p>Responsibilities</p><p>Create attractive designs and layouts for various projects<br />Meet with client in order to understand the client's objectives and desires<br />Communicate effectively with client, vendors and team in order to address client's needs<br />Prepare presentations (3D, 2D,mock-ups and renderings) for clients<br />Create quotes for clients and ensure full workflow is followed<br />Maintain industry knowledge in order to stay relevant</p><p>Qualifications</p><p>Bachelor's degree 2 - 3 years of experience in related field Proficient in AutoCAD<br />Strong creative and communication skills<br />Demonstrated ability to execute</p><b>Company</b><p>Nest Butler is a custom-made furniture design company founded by a mechanical engineer and an interior designer. We questioned a number of problems that have existed for decades, e.g. ambiguous pricing, expensive operating model, constant delays in project delivery, unmet customer's expectation on product design and quality and etc.. We strived to resolve these issues by taking advantage of the 21st-century technologies such as Artificial Intelligence, Cloud Computing and Internet of Things to revolutionise a century old industry that hasn't been disrupted for decades.</p>-",https://www.jobstreet.com.my/en/job/interior-designer-1034451749
Junior Geologist,14 hours ago,"<b>Description</b><p>• Assist to analyse and provide recommendations for slope design and failures using available analytical techniques including numerical models and limit equilibrium methods.<br />• Inspect slope to check for sign of geotechnical stress, instability, rock fall or other hazardous conditions.<br />• Collect, understand, install, analyze and interpret slope monitoring data by mapping and site verification. This include data collection, utilizing software and presenting and reporting monthly or weekly as needed.<br />• Preparation of maps.<br />• Maintain the quality and integrity of the geological models and database.<br />• Knowledge and skill using the full site of MS office tools (word, excel, access, outlook), AutoCAD, GIS, ArcGIS and other related software.<br />• Self-motivated and possess the ability to work independently as well as able to work with others as a team.<br />• Ability to be flexible, and handle multiple priorities in team-based environment.<br />• An ability and desire to travel and work in different locations.<br /></p><b>Company</b><p>Malvus Sense Sdn. Bhd. was established on 25 Mei 2016 and the headquarters located at Bandar Seri Putra Bangi, Selangor while the branch office located at Miri, Sarawak. The company specializes in Unmanned Aircraft System (UAS) Services across various fields. Malvus Sense is a 100% bumiputera company.</p><p>The main business segment covers airborne informatic – Engineering, Geological, Geospatial Technology Analytic and Solutions, Geospatial Data Management, IT and Artificial Intelligence. Besides, the company also provides sales and service of industrial UAV-related products, counter UAS -detection and elimination. The company also conduct a professional UAS Pilot and GIS Spatial Data Consultation and Training.</p>-",https://www.jobstreet.com.my/en/job/junior-geologist-1034589406
Interior Designer - Intern,14 hours ago,"<b>Description</b><p>We are seeking an enthusiastic and talented Interior Design Intern to join our team in the cabinetry industry. Our company specializes in designing and manufacturing custom cabinetry for residential and commercial properties. As an intern, you will be working closely with our team of experienced designers and will have the opportunity to gain hands-on experience in the industry.</p><p>Job Scope:<br />* Designing custom cabinetry for residential and commercial properties<br />* Creating 3D renderings and presentations for clients<br />* Collaborating with the all team to create and develop new concepts<br />* Assisting with project management and coordination<br />* Researching new materials and design trends<br />* Participating in client meetings and presentations as well as site visits</p><p>Requirements:<br />* Candidate must possess at least a Diploma/Degree in Interior Design or Architecture Interior Design or in any relevant fields.<br />* Proficient in AutoCAD, Microsoft Office and 3D design software<br />* Strong attention to detail and ability to multitask<br />* Excellent communication and teamwork skills<br />* Passion for design and the cabinetry industry<br />* Willingness to learn and take direction</p><b>Company</b><p>Nest Butler is a custom-made furniture design company founded by a mechanical engineer and an interior designer. We questioned a number of problems that have existed for decades, e.g. ambiguous pricing, expensive operating model, constant delays in project delivery, unmet customer's expectation on product design and quality and etc.. We strived to resolve these issues by taking advantage of the 21st-century technologies such as Artificial Intelligence, Cloud Computing and Internet of Things to revolutionise a century old industry that hasn't been disrupted for decades.</p>-",https://www.jobstreet.com.my/en/job/interior-designer-intern-1034451449
Sales Designer - Internship,14 hours ago,"<b>Description</b><p>Job Descriptions: -</p><p>Responsible for personal sales performance, establishing contact and developing good relationships with prospects; recommending solutions prospects<br />To handle customers queries and complaints promptly and professionally<br />Meet and exceed targets set for sales, daily and monthly<br />Record, analyse and report sales in CRM system<br />Maintains professional and technical knowledge by attending educational workshops or work related seminars<br />To develop 2D/3D design concept and space planning with detailed work specifications<br />Work closely with the design teams in preparation of 3D visualization<br />To reproduce designer’s concept into a graphic form, interpret artistic design to represent the ideas in a graphic form and into photo-realistic 3D renderings and Virtual Reality (VR)<br />To read and accurately interpret design illustrations, 2D CAD files, or other 3D modelling data, as specified within projects and realising those designs as compelling imagery<br />To provide efficient modelling and converting of data sets from AutoCAD or other 3D modelling packages<br />Perform other duties as assigned from time to time.<br />Job requirement: -</p><p>With/Without experience are welcome to apply (training provided)<br />Good communication skill, customer service oriented and dedicated to provide excellent customer service<br />Confident, out-going, approachable, energetic &amp; possess positive attitude<br />Knowledge in designing software(e.g., Autocad, 3D Max) for interior designing<br />Ability to multi-task in a demanding fast paced environment and work independently</p><b>Company</b><p>Nest Butler is a custom-made furniture design company founded by a mechanical engineer and an interior designer. We questioned a number of problems that have existed for decades, e.g. ambiguous pricing, expensive operating model, constant delays in project delivery, unmet customer's expectation on product design and quality and etc.. We strived to resolve these issues by taking advantage of the 21st-century technologies such as Artificial Intelligence, Cloud Computing and Internet of Things to revolutionise a century old industry that hasn't been disrupted for decades.</p>-",https://www.jobstreet.com.my/en/job/sales-designer-internship-1034451742
Technician - Plumbing,14 hours ago,"<b>Description</b><p>A Plumber is a professional responsible for installing, repairing, and maintaining pipes in commercial structures like apartment buildings or residential homes. They collaborate with other construction professionals such as general contractors or electrical team to ensure everything goes according to plan during renovations or furniture installation of customer house.</p><p>Plumber Job Responsibilities:</p><p>• Reading blueprints or drawings to understand or plan the layout of plumbing, waste disposal and water supply systems<br />• Cutting, assembling and installing pipes and tubes with attention to existing infrastructure (e.g. electrical wiring)<br />• To install and maintain well-functioning systems that transport water<br />• Installing and maintaining water supply systems<br />• Must have a thorough knowledge of hydraulic systems<br />• Individuals with a practical mind and manual dexterity<br />• Able to work efficiently with great attention to detail</p><p>Qualifications/Skills:</p><p>• Solid understanding of water distribution and disposal systems in residential, commercial and industrial buildings<br />• Working knowledge of heating and ventilation systems as well as appliances<br />• Ability to handle plumbing tools and equipment (pipe wrenches, pipe cutters, plungers etc.)<br />• Good communication and interpersonal skills<br />• Friendly with a great deal of patience<br />• Good physical condition and strength with the ability to work in awkward spaces</p><p>Education and Experience Requirements:</p><p>- Proven experience as a plumber ( 2-3 years working experience )<br />- Diploma ( Vocational/Technical ), CIDB course</p><b>Company</b><p>Nest Butler is a custom-made furniture design company founded by a mechanical engineer and an interior designer. We questioned a number of problems that have existed for decades, e.g. ambiguous pricing, expensive operating model, constant delays in project delivery, unmet customer's expectation on product design and quality and etc.. We strived to resolve these issues by taking advantage of the 21st-century technologies such as Artificial Intelligence, Cloud Computing and Internet of Things to revolutionise a century old industry that hasn't been disrupted for decades.</p>-",https://www.jobstreet.com.my/en/job/technician-plumbing-1034450927
