jobTitle,postedDate,jobDescription,jobUrl
DevOps Engineer (Linux OS),1-Feb-23,"<p><strong>Job Description</strong></p><p>We are seeking for an experienced DevOps Engineer/Senior Application Support Specialist to join our team.</p><p>You will provide consultation, guidance and problem solving expertise with respect to complex technical issues. You need to ensure the software applications environment is well developed and maintained with high quality.</p><p>As a Service Owner and Recovery Manager, you will need to ensure all agreed targets and Service Level Agreements are met and emergency incidents are managed and resolved within the agreed target resolution times.</p><p><strong>WHAT YOU WILL DO</strong></p><ul><li>To provide 2nd level support for the existing logistic application</li><li>To provide advice and identify opportunity within the organization and partners.</li><li>Assist with quality assurance of activities and educate less experienced colleagues in related areas.</li><li>Liaises with staff for the development of system enhancements to overcome known problems or further fulfil user requirements</li><li>To provide advice and identify opportunities within the organization and partners.</li><li>Be responsible for the adoption of new software releases from systems development staff or software suppliers and ensuring the continued support of the service thereafter</li><li>Act as Service Owner for regional service, Global or Top Service By Revenue</li><li>Be assigned to specific project related tasks by Project Manager.</li><li>Provide guidance and advice to team members</li></ul><p><strong>APPLICATION YOU WILL USE:</strong></p><ul><li>Unix command</li><li>Shell Scripting</li><li>Oracle SQL</li></ul><p><strong>WHAT YOU SHOULD HAVE:</strong></p><ul><li>Degree in Computer Science, Information Systems or equivalent experience</li><li>Overall 5-8 years of working experience in Application Support and ITIL Process.</li><li>Experience in trouble-shooting &amp; Strong Analytical skill</li><li>Experience in Unix Shell Scripting and Weblogics</li><li>Webmethods and java knowledge is added advantage.</li><li>Must be able to provide 24x7 on call rotational support</li><li>Must be able to on 3 rotational shifts (morning, noon and midnight)</li><li>ITIL foundation and project management techniques</li><li>Analytical and conceptual thinking and information acquisition</li><li>Persistence, initiative and creative person</li><li>Constantly follow up, monitoring and can make good decision making</li><li>Customer Focus</li><li>Organizational awareness</li><li>Willing to work in DevOps environment</li></ul><p><strong>WHAT YOU WILL GET FROM US</strong></p><ul><li>Great Team of IT Professionals with Global Working Exposure</li><li>Flexible Benefits – Customized According to Individual Needs</li><li>On-Going Professional and Technical Training and Certifications</li><li>A Multicultural Environment in Modern Offices</li><li>Choose Any Day for Your Vacation From Earned Public Holiday (Saturday and Ad Hoc)</li><li>Smart Casual Everyday</li><li>Global Internal Job Opportunities Available Within DPDHL</li><li>Unlimited Outpatient Medical</li><li>Home Office Possibilities</li></ul><p>Sounds good? Start your application now!</p>",https://www.jobstreet.com.my/en/job/devops-engineer-linux-os-5263379
Senior System Engineer (DevOps),31-Jan-23,"<p>Join us as a Senior System Engineer! Our company provides advance equity trading systems to majority of the financial broking firms in Singapore &amp; Malaysia. Our clients also include major international banks in Asia.</p><p>Attractive remuneration &amp; benefits for qualified candidates.</p><p>We are also currently on a hybrid work arrangement where you can work from home on selected days of the week. Candidates will need to have stable internet connection while working from home.</p><p>You will be involved with</p><ul><li>Perform daily applications &amp; system health checks</li><li>Manage and support company's IT infrastructure (Network, System, Storage, IP Telephony System &amp; etc)</li><li>Provide end user device support for internal staff</li><li>Prepare and maintain proper documentations on IT assets, network diagrams, system configurations etc.</li><li>Member of application release deployment team, responsible for deploying application releases to UAT &amp; Production environment</li><li>Liaise with vendors on procurements, installations &amp; support related matters</li><li>Occasional after hours and weekend support is required with off-in-lieu given accordingly</li><li>Any other assignment as assigned by Manager or Management</li></ul><p><strong>Job Requirements</strong></p><ul><li>Diploma/Degree in IT or equivalent</li><li>At least 5 year(s) of working experience in the related field is required for this position</li><li>Strong working experience in RedHat Enteprise Linux &amp; Windows Servers Operating System, Fortigate firewalls, Hypervisor (Linux KVM &amp; Windows HyperV) and related IT Infrascrtucture technologies</li><li>Possess RHCSA/RHCE cerification will be an added advantage</li><li>Working knowledge on network protocols and technologies such as TCP/IP, DNS, HTTP, VLAN, VPN etc</li><li>Able to work independently with good initiative and willingness to take on responsibility.</li></ul><p>When you join our enthusiastic and close-knit team, you can look forward to these benefits:</p><ul><li>Medical insurance &amp; benefits, competitive annual leave, birthday leave, study leave etc</li><li>Regular staff teambuilding activities</li><li>Stable work environment with supportive managers</li></ul>",https://www.jobstreet.com.my/en/job/senior-system-engineer-devops-5261866
"DevOps Engineer, Loyalty SaaS Platform",30-Jan-23,"<p><strong>Description</strong></p><p>Eber is a Loyalty Marketing Software where we help businesses to run Loyalty and Rewards programs. We work with brands like Secret Recipe, Zen &amp; Co, and Holiday Villa Hotels. We are looking for motivated individual to join our growing and connected team.</p><p><strong>We are looking for an experienced DevOps engineer who want to laser focus in building and growing a Loyalty SaaS solution internationally. You will be greatly involved with our small team of product personal and developers. Ensure high quality delivery of our SaaS product. Contribute ideas to drive improvements.</strong></p><p>If this is what you like to do day to day. If you love startup environment. If you are a people person, believe in growing as a team, working hard + working smart can translate into amazing results - APPLY NOW!!!</p><p><strong>Key Responsibilities:</strong></p><ul><li>Working with internal developers team to ensure high quality of SaaS delivery through multi-cloud deployments. Ensure Eber meeting its SLA.</li><li>Developing tools to monitor the health of infrastructure, and owning this monitoring. Monitoring includes service uptime, log, and cloud service cost.</li><li>Responding to situations where there are problems with the infrastructure.</li><li>Working with CI/CD tools.</li><li>Managing databases, verifying data integrity, and providing administration.</li><li>Suggest and performance tuning, balancing, improvement, automation, and usability at development level.</li><li>Participating in project meetings with internal team and customers.</li><li>Creating/maintaining technical documentation, guides, and tools.</li><li>Maintain a secure infrastructure with knowledge in security guideline, tools and tests.</li><li>Maintain an infrastructure complying with in ISO and SOC2 requirements.</li></ul><p><strong>Development Experience:</strong></p><ul><li>Experience with SQL server</li><li>Experience in an agile development team</li><li>Experience with CI/CD tools e.g., TeamCity, Octopus, Azure DevOps</li><li>Experience in AWS, ideally Azure</li><li>Knowledge of monitoring tools</li></ul><p><strong>You Are Required To:</strong></p><ul><li>Have minimum 3 years experience in a technical role</li><li>Have experience in a DevSecOps related role</li><li>Have experience with SaaS development</li><li>Comfortable working in a startup environment and culture.</li><li>Ideally knowing English, Mandarin and basic Vietnamese to conduct meetings with clients and teammates.</li><li>This is a hybrid WFH and WHO role.</li></ul><p><strong>Why Eber?</strong></p><ul><li>For someone who prefer to work in a small and connected team, making faster and better decisions, focus on single growing product - versus endless unproductive meeting in larger corporate environment.</li><li>Building the next generation Loyalty Marketing Platform. With with teammates across 3 South-east Asia offices in Singapore, KL, Ho Chi Minh City.</li><li>Laser focus in building single product used by thousands of businesses and drive improvements.</li><li>Opportunities to work with customers internationally.</li><li>Open and collaborative environment to share ideas, feedback to make things better for long term growth. Zero tolerance to politics.</li><li>We value skills upgrade and provides support to make you a better person, both professionally and personally.</li><li>Enjoyable startup work environment and culture - we work and play hard.</li></ul><p><strong>Remuneration and Benefits</strong></p><ul><li>Salary starting from RM7,000</li><li>Other benefits such as Medical and Annual Leave.</li></ul><p>If you love startup environment. If you are a people person, believe in growing as a team, working hard + working smart can translate into amazing results - APPLY NOW!!!</p>",https://www.jobstreet.com.my/en/job/devops-engineer-loyalty-saas-platform-5254142
Senior IT Software Engineer (Lyve Cloud),30-Jan-23,"<strong>About our group:</strong><p><strong>LYVE CLOUD</strong> is an exciting new entry of Seagate in the cloud services marketplace. We are now proud to offer storage in the cloud. Our Object Storage is S3 compatible and positioned for multiple data-intensive use cases - including backend for backup and archive, big data analytics, and several others across industry verticals.</p><p><strong>WHO ARE WE? </strong>We are an agile fast-moving team, responsible for building, operating, and managing Seagate’s cloud infrastructure, API and fully automated CI/CD pipeline. A blend of skillsets and diverse background make this a cross-functional team that delivers the technology that serves millions daily active users.</p><p>""Come join the Lyve Cloud organization which is the newest service offering from Seagate! This is an exciting new cloud-based space that is both challenging and rewarding for driven individuals.</p><p><strong>OUR CULTURE</strong></p><p>Growth &amp; Development - You will learn and help us develop new technologies as part of this quest. Whether you want to advance to a role with more responsibility or learn how to do your job more efficiently and creatively, we will be listening. Your professional growth is our priority.</p><strong>About the role - you will:</strong><ul><li>Join a dynamic team in defining, designing, and building high-quality software solutions while evangelizing technologies, solutions, and best practices</li><li>Be the collaborators with product management teams to ensure we're building the best reliable products</li><li>Apply your creativity and innovation in writing and testing code to ensure compatibility and stability: refine and rewrite as necessary</li><li>Be a subject matter expert; involve and actively contribute to technical discussions</li><li>Contribute new ideas to a larger community of high caliber professionals, a key to the cutting-edge technology</li></ul><strong>About you:</strong><ul><li>A self-driven, proactive, and out of the box thinker, passionate in programming/development role</li><li>Adaptable to fast-paced, dynamic work environments and shifting demands</li><li>Fast learner and craving for new learning opportunity (Golang, Microservices, Kubernetes)</li><li>Highly collaborative, team-oriented and an effective communicator</li><li>Flexible and demonstrate strong judgment/decision-making skills</li><li>Creative and has a knack for innovation</li><li>Diploma/Degree in Information Technology or related field</li></ul><strong>Your experience includes:</strong><ul><li>At least 5 years of experience with software application development (e.g Java, C#, .NET). Relevant experience within 2-5 years can be considered for mid-level role</li><li>Good working background in REST API and Microservices development</li><li>Agile software development (Scrum)</li></ul><p>An added advantage if you acquired:</p><ul><li>Experience with container technologies (Kubernetes)</li><li>Exposure in design and development of cloud services systems and platforms</li><li>Familiarity with RDBMS (Postgres) and NoSQL (MongoDB, Cassandra) database</li><li>Excellent knowledge of Linux command</li><li>Knowledge of Jira workflow, DevOps and CI/CD implementation</li></ul><strong>Location:</strong><p>Our Penang office is located in Suntech at Cybercity. Easily accessible from two bus stops, many employees take mass-transportation to work. Ample free on-site parking is also available. Enjoy our on-site gym, test your ping-pong skills, or take on your colleagues in a badminton match after work. You can grab breakfast, lunch and coffee at our on-site cafe. Prefer to eat off-site? The public food court across the street offers many delicious options. Our Absolute Privilege club also offers Seagate employees deals for discounted food, beverages and services.</p>",https://www.jobstreet.com.my/en/job/senior-it-software-engineer-lyve-cloud-5260281
DevOps Engineer,20 hours ago,"<strong>Responsibilities</strong><ul><li>Manage IT infrastructure related (but not limited) to source control and build</li><li>Establish, enhance and maintain CI/CD pipelines for existing and new services</li><li>Communicate with geographically diverse colleagues to setup CI/CD for the teams as well as guiding them on how to manage it</li><li>Assist teams in diagnosing and performing root cause analysis in deployment and infrastructure issues and resolve technical issues</li><li>Use automation tools but where not available, will code and script</li><li>Provide on-call support when issue happen or system peak usage times</li></ul><strong>Requirements</strong><ul><li>Have aptitude for problem solving</li><li>Not shy in communication</li><li>Engineering background fluent in at least one programming language (preferably C# or willing to transition to it)</li><li>A demonstratable history in actively setting up CI/CD from start to end</li><li>Well versed with Linux command line</li><li>Expertise in containerisation using Docker and Kubernetes</li><li>Expertise in at least one major public cloud provider of either AWS, Azure, and/or GCP</li><li>Knowledge of modern infrastructure architecture, networking and security principles</li></ul>",https://www.jobstreet.com.my/en/job/devops-engineer-5266611
Lead DevOps Engineer [ID 4844],22 hours ago,"<p><strong>Danske Bank</strong> is a Nordic bank with strong local roots and bridges to the rest of the world. For more than 145 years, we have helped people and businesses in the Nordics realize their ambitions. Today, we serve personal, business and institutional customers and in addition to banking services, we offer life insurance and pension, mortgage credit, wealth management, real estate and leasing services.</p><p>In Denmark, Danske Bank’s roots go back to 1871, when Den Danske Landmands bank was founded. Through the years, the bank has grown through mergers with many local and regional banks. One of the most important mergers took place in 1990, when Den Danske Landmands bank merged with two other major Danish banks, making Danske Bank the largest bank in Denmark.</p><p><strong>Danica Pension</strong> is a wholly-owned subsidiary of the Danske Bank Group. We have regional offices in large towns around Denmark and subsidiaries in Norway and Sweden, where we are seeing strong growth.</p><p>With more than 600,000 customers, we are one of the largest pension companies in Denmark. We specialize in pensions, life insurance and health insurance and we have total pension funds of DKK 380 billion and annual contributions of DKK 33.8 billion. Danica Pension employs some 700 people.</p><p>We are looking to expand our development team in Kuala Lumpur.</p><p><strong>As a Lead Devops Engineer, you will be</strong></p><p>• Automating infrastructure provisioning, maintenance, and software configuration tasks</p><p>• Setup and configuration of Development and Production environments</p><p>• Setup and configuration of CI/CD tools and processes</p><p>• Setup and configuration of Application monitoring</p><p>• Providing 2nd and 3rd level support of owned Tech Stack</p><p>• A lot of communication with developers and other IT teams</p><p><strong>Must have:</strong></p><p>• Direct experience with any scripting/programming language</p><p>• Good understanding of Infrastructure as Code and Configuration as Code technologies</p><p>• Experience working with container technologies such as Docker</p><p>• 1+ year of relevant experience with CI/CD</p><p>• 2+ years of experience managing Linux/Windows Servers</p><p>• Openshift/Kubernetes</p><p>• Good understanding of Application monitoring</p><p>• Good Understanding of Networks</p><p><strong>Good to have:</strong></p><p>• Automating technologies such as Chef, Puppet or Ansible</p><p>• Knowledge of queue systems such as Rabbit, Jenkins or Azure Devops</p>",https://www.jobstreet.com.my/en/job/lead-devops-engineer-%5Bid-4844%5D-5266299
DevOps Engineer J40010,30-Jan-23,"<p><strong>We are hiring for a DevOps Engineer to work alongside with us to enable application delivery teams across 60+ agencies to adopt modern application delivery practices:</strong></p><ul><li>Exploring Singapore Government latest Tech-Stack in multiple public cloud providers such as AWS, Azure or Google Cloud</li><li>Working in a team to execute Application Development Modernization initiative</li><li>Encouraging work-life balance and healthy working environment</li><li>5 days work weeks with standard working hours</li><li>Central</li></ul><p><strong>Responsibilities:</strong></p><ol><li>Adopting the modern app delivery practices such as CI/CD, DevSecOps, ""Shift Left"" security test, etc to improve overall quality, security &amp; speed of app delivery</li><li>Develop standardized technical solution, such as reference CI/CD pipelines, reusable scripts for automation of common development, security &amp; operation tasks</li><li>Develop &amp; deliver relevant resources, guide/playbook, and training to equip users involved in application delivery with the right knowledge &amp; skills</li><li>Develop pipelines and scripts to automate build, test, deployment, and release</li></ol><p><strong>Requirements:</strong></p><ul><li>min. Diploma in Computer Science / Computer / Information Technology or any related disciplines</li><li>min. working experience with CI/CD, using preferably Gitlab, for applications developed in Java, .Net, and/or JavaScript</li><li>Skills in scripting languages such as Bash or PowerShell</li><li>Experience with containerized platform such as Docker or Kubernetes and public cloud providers such as AWS, Azure or Google Cloud</li></ul><p>If you are interest in this opportunity, submit your application now to <strong>spvn(at)scientecpersonnel.com</strong> by indicating<strong> Job ID J40010 </strong>to fasten the process.</p><p>Ng Kee Hung (Vickus) - R2091423</p><p>ScienTec Consulting Pte Ltd – 11C5781</p>",https://www.jobstreet.com.my/en/job/devops-engineer-j40010-10388033/origin/sg
"URGENT / System / Cloud Engineer (Japan MNC, Azure, AWS, AD)",3 hours ago,"<ul><li>Permanent job opportunity</li><li>Great remuneration and benefits</li><li>Great career progression</li></ul><p><strong>Responsibilities</strong>:</p><ul><li>Responsible for compute areas incl. infra. servers, cloud instances, cloud landing zone, applications, storage, manage data center activity.</li><li>Administration multiple windows and non-windows server roles/features comprising file server, cloud system, linux, update servers and relevant infra and application servers.</li><li>Collaborating with solution team to evaluate and identify optimal cloud solutions, ability to design, modify and improve existing systems instances, deploy cloud-based systems.</li><li>Ensures systems smooth and efficient, ensure efficient function of cloud data storage and process accordance with company security policies and best practices in cloud security. e.g., identify, analyze, and resolve infra. vulnerabilities and application deployment issues, regularly review of existing systems and make recommendations for improvements.</li><li>Oversee and administer a variety of server products and services, especially the cloud server and services, virtualization systems, patch management systems, SSO, etc.</li><li>Supervise compute operations ensuring servers and cloud issues are properly managed and documented.</li><li>Interact with clients, provide cloud support, and make recommendations based on clients needs.</li><li>Take part in DR /backup events, involve in planning of availability, disaster recovery and backup recovery when needed</li></ul><p><strong>Requirements</strong></p><ul><li>Proven knowledge and experience in managing servers, Active Directory, Data centre hosting, Azure and AWS cloud administration.</li><li>Server and cloud certification preferred.</li><li>Experience in designing cloud system environment, able to manage cloud resource with automation, able to troubleshoot and having analytical skills.</li><li>Minimum 2-3 years’ experience supporting relevant compute (cloud, servers) areas.</li><li>Some knowledge in scripting a plus.</li><li><br /></li></ul><p><strong>HOW TO APPLY:</strong></p><p>Interested applicants, please click send your revised resume to <strong>ref27(at)trustrecruit.com.sg </strong>or click on “<strong>Apply Now</strong>” and provide the below details in your resume.</p><ol><li>Current salary (breakdown)</li><li>Expected salary</li><li>Notice period</li><li>Reason of leaving</li></ol><p>We regret only shortlisted candidates will be notified.</p><p><strong>Important Note</strong>: Trust Recruit Pte Ltd is committed to safeguarding your personal data in accordance with the Personal Data Protection Act (PDPA).</p><p>Please read our privacy statement on our corporate website www.trustrecruit.com.sg.</p><p>Trust Recruit Pte Ltd    </p><p>EA License No: 19C9950</p><p>EA Personnel: Tan Yee Chean (Chester)</p><p>EA Personnel Reg No: R22110448</p>",https://www.jobstreet.com.my/en/job/urgent-system-cloud-engineer-japan-mnc-azure-aws-ad-10406776/origin/sg
Cloud System Engineer (AWS | Terraform),16 hours ago,"<p><strong>Cloud System Engineer</strong></p><ul><li><strong>Working Hours: Mon-Fri</strong></li><li><strong>Working Location: Central</strong></li><li><strong>Technologies: AWS Cloud / Terraform / SaaS Platform</strong></li><li><strong>Remuneration Package: Up to $7000 (basic) + bonus (2-3 months)</strong></li></ul><p><strong>Responsibilities</strong></p><ul><li>Assist the team in design, planning, management, maintenance and support of cloud infrastructure services.</li><li>System architecture, installation, configuration of system in cloud environment.</li><li>Automate tasks and implement infrastructure services.</li><li>Schedules, develops and implements risk closure plans.</li><li>Monitor, maintain and supervise (L4) cloud environment, OS related and network security infrastructure to optimal performance.</li><li>Troubleshooting, performs root cause analysis, implements corrective/preventive actions during and after an incident.</li><li>Prepare documentation for the systems, scripts, procedures in accordance with department and corporate standards while building and disseminating knowledge of key business processes.</li></ul><p><strong>Requirements</strong></p><ul><li>A minimum of 2 years experience with cloud services including open source</li><li>technology, software development, system engineering and work with Major Cloud Service provider.</li><li>Experience with APIs, orchestration, automation and databases, both rdbms and nosql.</li><li>Working knowledge and methodologies of Terraform, GIT, Jenkins, Consul, Vault, Kubernetes, Docker, Ansible, ELK, Prometheus/Grafana</li><li>Experience with scripting languages (e.g. python, bash, sh)</li></ul><p>If you are excited with this opportunity and enjoy making things happen, do apply now!</p><p>OR</p><p>Email your updated resume to: speytu(at)scientecpersonnel.com by quoting ""J40073"" in your email subject for faster processing. </p><p>By submitting any application or resume to us, you will be deemed to have agreed &amp; consented to us collecting, using, retaining &amp; disclosing your personal information to prospective employers for their consideration. Please refer to ScienTec’s Privacy Policy https://www.scientecconsulting.com/privacy-policy for full details. If you wish to withdraw your consent, please write to us at dpo(at)scientecconsulting.com.</p><p>(Note: Any resumes of job applications sent to this mailbox will not be attended as it is solely for the purpose of personal data protection related matters.)</p><p>Elane Yap Theng Yu- R1989397</p><p>ScienTec Consulting Pte Ltd - 11C5781</p>",https://www.jobstreet.com.my/en/job/cloud-system-engineer-aws-%7C-terraform-10406004/origin/sg
