jobTitle,postedDate,jobDescription,jobUrl
Senior AWS System Administrator,31-Jan-23,"Job Descriptions:<ul><li>Deploy a solid infra through AWS to provide WEB/Mobile services across the region.</li><li>Responsible for the company's Cloud Computing Services</li><li>Hands-on experience on system infrastructure setup, familiar with AWS Lambda, API Gateway, Multi-AZ for HA deployment, able to achieve zero downtime and scale-up and scale-out and setup automation system healthiness status, log alert and monitoring</li><li>Set up and troubleshoot organization’s servers, conduct server back up, and maintaining the Cloud services.</li><li> Disaster Recovery planning</li></ul>Job Requirement:<ul><li><strong>Advanced knowledge of AWS Cloud Computing services, servers: Linux</strong>.</li><li>A creative thinker with the ability to analyze and break down processes, proven capability to resolve issues effectively.</li><li>Effective communication skills, with good command of English.</li><li>Candidate must possess at least a Diploma, Advanced/Higher/Graduate Diploma, Bachelor's Degree, Post Graduate Diploma, Professional Degree, Computer Science/Information Technology, Engineering (Computer/Telecommunication) or equivalent.</li><li>Required skill(s): <strong>AWS, LINUX, UNIX.</strong></li><li>At least 3 year(s) of working experience in the related field is required for this position.</li><li>Applicants must be willing to work in I-City Shah Alam.</li><li>Preferably Senior Executives specializing in IT/Computer - Network/System/Database Admin or equivalent.</li><li>Full-Time position(s) available.</li></ul>",https://www.jobstreet.com.my/en/job/senior-aws-system-administrator-5248585
Software Engineer,27-Jan-23,"<p> <strong>Job Responsibilities:</strong></p><ul><li>Provide innovative solutions to complex business problems</li><li>Plan, develop and implement large-scale projects from conception to completion</li><li>Develop and architect lifecycle of projects working on different technologies and platforms</li><li>Design, develop and implement new integration</li></ul><p><strong>Job Requirements:</strong></p><ul><li><strong>Proficient in Java and preferably in Python as well</strong></li><li>Basic understanding of database i.e MongoDB, MySQL databases is a plus</li><li>Good understanding of Object-oriented programming</li><li>Basic understanding in version control systems e.g. Git</li><li>Basic understanding in Linux operating system</li><li>Basic understanding of cloud services – Azure, AWS, etc</li><li>Basic understanding of Devops</li><li>A degree in Computer Science or equivalent industry experience</li><li>Passionate with building elegant, scalable software that solves practical problems</li><li>Preferably Senior Executives specializing in IT/Computer - Software or equivalent</li><li><strong>Applicants must be willing to work in Mid Valley City, KL</strong></li></ul><p><strong>How this career will benefit you?</strong></p><ul><li>Flex benefit &amp; Allowance</li><li>Medical &amp; Insurance</li><li>Free Parking (reimburse)</li><li>Training for a good career development</li><li>Work 5 days a week</li><li>State Public holidays observed</li><li>Free breakfast and lunch provided</li></ul>",https://www.jobstreet.com.my/en/job/software-engineer-5245189
Development Team Leader,1-Feb-23,"<ul><li>Working within an Agile Development Team, Scrum framework</li><li>Leading and managing a team of Software and Senior Software Engineers through performing appraisals, monitoring performance and identifying any training needs for the team</li><li>Implementing new features across the Ideagen Products</li><li>Working closely with R&amp;D Team, Development Manager, Team Leaders, Principal Developers and Senior Software Engineers to build well architected Cloud hosted and On-Premise solutions</li><li>Working collaboratively with Product Managers, Product Owners, Business Analysts, Design Engineers, Development Engineers (Front End), Test Engineers, and Infrastructure Engineers to ensure features are delivered to a high standard</li><li>Contributing towards the defining and developing of a Sprint backlog to achieve the goals set out by our Product team</li><li>Collaborating with the Product Design Team to create an optimal user experience</li><li>Working across the Software Development Lifecycle ensuring that our products are delivered to a published roadmap within planned release cycles</li><li>Providing unit tests to support and validate for any development work undertaken</li><li>Creating necessary documentation relating to work produced</li><li>Contributing to the Development Team’s working practices and technology decisions</li></ul><p><strong>Knowledge &amp; Experiences:</strong></p><ul><li>Preferably 1 years’ experience leading a software development team</li><li>Front end development experience specifically React, jQuery, HTML, CSS and JavaScript/TypeScript</li><li>Working knowledge of CI/CD workflow specifically Jenkins, Azure DevOps</li><li>Working knowledge of using Git as software version control</li><li>Has exposure in Docker containers, Kubernetes.</li><li>Experience in planning and implementing code analyser and coverage automation.</li><li>Experience in Microservices software design, development and deployment on public cloud infrastructure (AWS)</li></ul>",https://www.jobstreet.com.my/en/job/development-team-leader-5262908
DevSecOps/CloudOps Engineer,27-Jan-23,"<p>We are seeking highly motivated individuals skilled in DevOps to join us for some exciting projects. You’ll work with a multidisciplinary team of designers, developers and business experts to deliver digital government solutions; enabling governments to unlock their digital assets and connect with their citizens</p><p><strong>What you will be working on:</strong></p><ul><li>Configure and maintain the CICD pipelines incorporating streamlined change and release management process</li><li>Maintain tools for configuration management, build, continuous integration, and deployment, reporting, monitoring etc.</li><li>Implement and operate monitoring and alerting tools</li><li>Implement scripts to automate server, CICD and other relevant tasks</li><li>Participate and implement capacity planning and risk management</li><li>Explore and adopt new and creative DevOps approaches to improve production reliability and availability.</li><li>Implement security practices that comply with standards to protect the organization &amp; infrastructure.</li><li>Working in highly collaborative teams and building quality environments. </li><li>Ability to effectively prioritize and execute tasks in a high-pressure, fast paced, global environment</li></ul><p><strong>What we are looking for:</strong></p><ul><li>3+ years of relevant DevOps experience</li><li>Hands-on experience working on AWS</li><li>Hands-on experience with containerization using Docker and Kubernetes</li><li>Strong scripting skills e.g. Python, Bash, JavaScript</li><li>Hands-on experience with configuration management systems such as Terraform, Puppet, Chef, Ansible</li><li>Hands-on experience with production deployments such as Kubernetes and automating provisioning with IaC best practices.</li><li>Experience in implementing monitoring strategies and dashboards e.g. ELK, Grafana, Prometheus</li><li>Experience with highly scalable distributed systems</li><li>Good understanding of virtualization and networking concepts</li><li>Breadth of knowledge - OS, networking, distributed computing, cloud computing</li><li>Manage the operations of cloud infrastructure and application services</li><li>Strong technical aptitude including excellent troubleshooting and communications skills</li><li>Good understanding and working knowledge of Agile projects</li><li>Knowledge in system architecture is a plus</li></ul>",https://www.jobstreet.com.my/en/job/devsecops-cloudops-engineer-10384543/origin/sg
Cloud Engineer,18-Jan-23,"<p><strong>Our Client</strong></p><p>Our Client is an exciting start up venture that is a registered Initial Exchange Offering (IEO) operator with the Securities Commission Malaysia seeking to operate a multi-asset, digital fundraising platform.</p><p>Built with the vision to be Malaysia’s leading dynamic and facilitative fundraising and investment hub, Our Client democratizes access to the capital markets for issuers. It offers financial products in a regulated, fair and efficient marketplace for investors who are looking to diversify their portfolios with high-growth investments.</p><p>Our client has the right enablers to deliver value for issuers and investors: a best-in-class digital solution and a strong team of experienced capital markets, technology and business professionals, as well as a set of established ecosystem partners.</p><p><strong>About the Job</strong></p><p>The cloud Engineer needs to be detail-oriented, proficient with technologies and virtualized hardware, and who flourishes in a fast-moving and at times, high-pressure environments. We expect the cloud Engineer to work with numerous business stakeholders, software developers and other technical staff. His/her responsibilities include upgrading and improving operating environments, creating repair and remediation strategies, and providing technical support and training for users.</p><p>The cloud Engineer should have good communication and collaboration skills, excellent analytical, problem-solving, and time-management skills, and familiar with cloud and devops solutions. The cloud engineer must be self-directed and comfortable supporting the technology infrastructure needs of multiple stakeholders, processes, products and systems.</p><p>The cloud engineer reports to the CTO.</p><p><strong>Key Responsibilities</strong></p><ul><li>Installing and maintaining AWS cloud operating environments</li><li>Monitoring these operating environments</li><li>Responding effectively and speedily to any problems</li><li>Ensuring operating environments stay safe and secure</li><li>Updating any software and hardware where necessary</li><li>Documenting all reported malfunctions and actions taken in response</li><li>DRP management and testing</li><li>Providing training and support</li><li>Staying updated and be in the forefront of new emerging technological trends and developments in the area of cloud infrastructural solutions and services and devops</li><li>Support DevOps engineering by developing code or scripts for automated testing</li></ul><p><strong>Skills</strong></p><ul><li>AWS Cloud Network configuration and management</li><li>AWS Cloud VM/container management</li><li>AWS IAM and Cognito configuration and management</li><li>Experience with code repositories and version control, ie. Github</li><li>Experience with CI/CD solutions such as GitLab</li></ul><p><strong>Experience</strong></p><ul><li>3 to 5 years’ Experience in cloud infra and DevOps engineering.</li></ul><p><strong>Qualifications</strong></p><ul><li>BSc. or MSc. in Computer Science, or equivalent</li></ul>",https://www.jobstreet.com.my/en/job/cloud-engineer-10359522/origin/sg
DevOps Engineer,11-Jan-23,"<p>DevOps Engineer, CI/CD, IaaC, SaaS.</p><p><strong>Your New Company</strong></p><p>Our client is Malaysia's leading PMS Provider, delivering custom software solutions for businesses of all sizes. Experienced developers creating innovative, user-friendly applications. Comprehensive services from concept to deployment.</p><p><strong>Your New Role</strong></p><p>In this role you will be responsible for -</p><ul><li>Automate deployments of SaaS for both public and private cloud.</li><li>Developing scripts to improve visualisation of monitoring data to decrease troubleshooting and resolution time.</li><li>Develop and test operational continuity scenarios in SaaS test and staging environments that impact and improve customer experience.</li><li>Creating CI/CD Pipelines and ensuring pipelines have no errors/issues. Troubleshooting CI/CD Pipelines as well and continuously improving it.</li></ul><p><strong>What you'll need to succeed</strong></p><ul><li>A Bachelor's degree in Computer Science, Information Tech &amp; Computer Engineering.</li><li>Ability to react quickly and adapt to changes in priorities, circumstances and direction.</li><li>Strong background in Windows.</li><li>Strong experience with Automation/Configuration management using Ansible, Puppet, Chef, or equivalent.</li><li>Strong experience with Infrastructure as a Code (IaaC) tools such as Cloud Formation, Terraform or equivalent.</li><li>Strong experience in deploying codes to AWS, MS Azure, Google Cloud.</li><li>Good scripting experience with Python, Perl, and/or Ruby or equivalent.</li><li>Able to work on weekends / night shifts.</li></ul><p><strong>What you'll get in return</strong></p><ul><li>An open and dynamic corporate culture.</li><li>Collaborative environment where everyone's decision plays a part.</li><li>Great interaction with colleagues from other IT departments to resolve cross functional and operational issues.</li><li>Attractive total remuneration packages.</li><li>Amazing steppingstone to improve your DevOps career!</li></ul><p><strong>What you'll need to do</strong></p><p>If you are an individual who craves a variety of challenging tasks with global reach and global exposure, then you are most welcome to apply and join! What are you waiting for? Hit 'Join Now!' to schedule a follow up session and kindly forward me your most up-to-date C.V ; or call me at (+603 7611 8600).</p>",https://www.jobstreet.com.my/en/job/devops-engineer-5243432
"Site Reliability Engineers (SRE, DevOps, Linux)",23-Jan-23,"<p>We are looking out for multiple <strong>Site Reliability Engineers (SRE, DevOps, Linux)</strong> with <strong>2-5 yrs and 5-8 yrs </strong>experience levels.</p><p><strong>Must Have:</strong></p><ul><li>Experience in observability, capacity planning, issue analysis and troubleshooting large-scale massively distributed, fault-tolerant systems running cloud native applications in micro services architecture;</li><li>Ability to debug scripts and automate routine tasks in OS, network, database or application servers. Coding experience beyond simple scripts;</li><li>Experience in<strong> Devops </strong>process, programming knowledge in at least one of the following languages: Java, Python, or Go;</li><li>Scripting skills in at least of the following: Shell, Terraform, Ansible, Chef or Puppet;</li><li>Deep Understanding of Unix/Linux operating systems, virtual machines, containers, Container management systems, Enterprise cloud platforms and data structures;</li><li>Engage in and improve the lifecycle of services—from Launch through to deployment, operation and optimization in reliability and user experience;</li><li>Ensure service reliability once they are live by measuring and monitoring availability, latency, and overall system health. Practice sustainable incident response;</li><li>Gather and analyze metrics from tech stack to assist in performance tuning and fault handling of P0/P1/P2/P3 type of issues;</li><li>Participate in system design suggestions, platform management, Balance feature development speed and reliability with well-defined service level objectives;</li><li>Measure and optimize system performance, with an eye toward pushing our capabilities forward, getting ahead of customer needs, and innovating to continually improve.</li></ul><p><strong>Good to Have:</strong></p><ul><li>Automation framework design using popular frameworks like salt stack, spinnaker, stack storm;</li><li>Experience on managing large scale Big data clusters;</li><li>Experience in Chaos engineering design and implementation;</li><li>Experience in large scale container management platform with auto scaling and intelligent scheduling;</li><li>Experience in Data analysis or data science or Data development of PB size data;</li><li>Experience of SIEM, threat modelling, vulnerability detection design, deployment and optimization;</li><li>Experience in cloud services network design, rules/policy creation, deployment, performance tuning;</li><li>Experience in DB consistency detection, slow query tooling, Performance tuning of middleware including RDBMS, NoSQL, distributed caches.</li></ul><p><strong><u>Professional Knowledge Requirements</u></strong></p><ul><li>Bachelor degree or above in Computer science/Electronics &amp; communication;</li><li>Have in-depth knowledge of <strong>SRE role</strong> and <strong>Devops process</strong>;</li><li>Have strong observation and critical thinking to handle business emergencies;</li><li>Ability to adapt to dynamic environment and apply problem solving skills to resolve issues;</li><li>Have excellent written and verbal communication skills;</li><li>Deep exposure to data analysis-based decision making scenarios;</li><li>Established record of continuous learning and upskilling tracking industry trends.</li></ul>",https://www.jobstreet.com.my/en/job/site-reliability-engineers-sre-devops-linux-5238865
DevOps Engineer,11-Jan-23,"<p>DevOps Engineer, Software background, Mobile App Dev, Business Dev.<br /><br /><strong>Your New Company</strong></p><p>Our client is the authorised importer of Premium Luxury Continental cars in Malaysia since 2010. They are under the Motors Division of the parent company. They focus in distributing continental vehicles and parts and provides after sales service in Malaysia.<br /><br /><strong>Your New Role</strong><br />In this role, you will be focusing on -</p><ul><li>Managing and developing IT Infrastructure and solutions for the Organisation, ensuring effective strategies and operational procedures are being put to place and implemented accordingly.</li><li>You will be required to contribute to the development of Digitalisation vision and strategies of the organisation in promoting business growth and maintaining good relations with key personnel and stakeholders.</li><li>Ensuring the Budget Capex for the specific business projects are managed appropriately to maximize returns.</li><li>Developing a couple of in-house products for internal use -<ul><li>Web Application - Developed using Angular and meant to digitise and automate the office work processes.</li><li>API - Developed using NodeJS and deployed on Windows Server.</li><li>Mobile App - Built using React Native</li><li>Database is MSSQL, Redis &amp; MongoDB.</li></ul></li></ul><p><strong>What you'll need to succeed</strong> -</p><ul><li>A full in-depth understanding of the Application Development Cycle from user requirements all the way to deployment and maintenance.</li><li>A degree in Information Technology or any relevant discipline.</li><li>Minimum 2 years in General IT / Programming / Business Development / Project Management.</li><li>Technical aspects required are<ul><li>Programming with Angular and Node JS.</li><li>Typescript &amp; JavaScript.</li><li>MSSQL &amp; MongoDB</li><li>C++</li><li>Additional requirements are (Added advantage)<ul><li>SharePoint.</li><li>GitHub.</li><li>General Web Development.</li><li>Other Programming languages.</li></ul></li></ul></li></ul><p><strong>What you'll get in return</strong> -</p><ul><li>An open and dynamic corporate culture.</li><li>Ability to dictate and decide the direction of the Digitalisation Road Map for the Organisation.</li><li>Great interaction with colleagues from other IT departments to resolve cross functional and project issues.</li><li>Exposure to the Automotive Industry and ability to work with Global teams.</li></ul>",https://www.jobstreet.com.my/en/job/devops-engineer-5243131
DevOps Engineer,9-Jan-23,"<p>Top leading BPO Organization looking for DevOps Engineer for expanding business.</p><p><strong>Your new company</strong></p><p>Your new organization is an industry leading BPO in Asia. They engage with global scale talents to work on the latest technologies like Machine Learning and Artificial Intelligence to improve products and processes, so that their customers can experience top level service. With offices around the world, be part of this ever-growing tech-forward team that is looking to expand their talented team moving forward.</p><p><strong>Your new role</strong></p><p>You will be responsible for the DevOps responsibilities on their GCP Cloud Platform, to be able to design and manage their automation pipelines. You will be responsible for creating and managing the standardised released approach that will be used throughout the SDLC process. You will also be responsible for managing and administrating their infrastructure to ensure optimum performance.</p><p><strong>What you'll need to succeed</strong></p><ul><li>Good experience and knowledge on Google Cloud Platform (Preferably). Is open to AWS Cloud as well.</li><li>Must have good experience with CI/CD Pipelines and best practices.</li><li>Must have experience and knowledge with Containerisation tools (Docker, Kubernetes)</li><li>Good to have experience with database administration using MySQL and/or MongoDB.</li></ul><p><strong>What you'll get in return</strong></p><ul><li>Great career opportunity with a leader in the market.</li><li>Competitive remuneration packages.</li><li>High ceiling for learning opportunities - Staff are encouraged and KPI-ed to take up additional courses via internal learning libraries.</li><li>Good team culture.</li></ul><p><strong>What you need to do now</strong></p><p>I am Sam, a Consultant from Hays Technology, specialising in IT Infrastructure for Kuala Lumpur, helping tech professionals develop their careers and ensuring organisations are supported by top talent. My passion for this space stems from building a business on strong principles of customer service and delivery.</p><p>At Hays Technology, we are shaping the future of recruitment. We are constantly speaking to organisations who rely on the optimisation of their Infrastructure, and the professionals who build them. So whether you are hiring for your team, or looking to take the next step in your infrastructure career, you may reach me at my email, or call us now at +603 27868600</p>",https://www.jobstreet.com.my/en/job/devops-engineer-5240206
DevOps Lead (Work from Home) J39896,13-Jan-23,"<p><strong>Looking for a lead to work with our DevOps team to ensure smooth delivery:</strong></p><ul><li>Salary package up to $11,000 + AWS + VB (approx. 2-3 months bonus)</li><li>5 days work week with flexible working arrangement</li><li>Dynamic &amp; fun working environment</li><li>Office Location: Tanjong Pagar</li></ul><p><strong>Responsibilities:</strong></p><ul><li>Collaborate with various teams to ensure successful delivery, maintenance planning &amp; correction of build errors</li><li>Day-to-day monitoring, backup, deployment and maintenance of systems</li><li>Develop / build / maintain continuous integration / deployment (CI/CD) pipelines and automated testing to support high quality software build in a continuous build/deploy environment using Jenkins Pipeline</li><li>Writing scripts/programs for service monitoring &amp; health check of systems</li><li>Automate &amp; build up scalable systems / environment using Kubernetes with infrastructure-as-code and GitOps strategy</li><li>Automate security hardening in testing, deployment &amp; production setup based on industrial best practices</li><li>Promote a DevOps culture </li></ul><p><strong>Requirements:</strong></p><ul><li>Min diploma in Computer science or any relevant discipline</li><li>Experience with load balancing setup for TCP/IP, HTTP, DNS, routings</li><li>Experience in computing platforms such as AWS / AliCloud / GCP / Azure (e.g. AWS: EC2, RDS, ELB, EFS, ELK, ElasticCache, S3, VPC, Glacier, IAM, CloudWatch, KMS, AMK, EKS)</li><li>Experienced with building and setting up high velocity and reliable CI/CD pipeline using tools/platforms such as Jenkins, Gitlab, Nexus, Maven, Spinnaker</li><li>Proficiency with containers and cloud orchestration tools such as Docker, Kubernetes</li><li>Proficiency with systems that support Infrastructure-as-Code ideals, such as Ansible AWX/Tower, RunDeck, Chef, Terraform, Puppet, Cloudformation and so on</li><li>Familiarity with deployment of application performance monitoring (APM), Jeager, Open Tracing, App Mesh, AWS X-ray</li></ul><p>To apply, please send your updated resume to <strong>spvn(at)scientecpersonnel.com</strong> by indicating<strong> Job ID J39896</strong> to fasten the process.</p><p>Ng Kee Hung (Vickus) - R2091423</p><p>ScienTec Consulting Pte Ltd – 11C5781</p>",https://www.jobstreet.com.my/en/job/devops-lead-work-from-home-j39896-10342836/origin/sg
